reports/hw03/raw/retrieval_semantic.json

{
  "technique": "Semantic",
  "query": "What food recalls are related to contamination or undeclared allergens?",
  "query_vector_shape": [
    384
  ],
  "doc_vectors_shape": [
    3,
    384
  ],
  "results": [
    {
      "rank": 1,
      "store_score": 0.6292,
      "cosine_sim": 0.6817,
      "chunk_len": 165,
      "preview": "By: Trophy Nut Co. Tipp City, OH 45371 Reason for Recall: The firm stated that the product contains undeclared allergens. Classification: Class II Status: Termi"
    },
    {
      "rank": 2,
      "store_score": 0.5897,
      "cosine_sim": 0.5577,
      "chunk_len": 749,
      "preview": "Recalling Firm: Oasis Brands, Inc Product Description: Crema GuateLinda (Guatemalan Style Cream) in individually soft poly/plastic bags labeled in part: Lacteos"
    },
    {
      "rank": 3,
      "store_score": 0.5871,
      "cosine_sim": 0.6027,
      "chunk_len": 262,
      "preview": "-Reser's Gourmet Tuna Salad packaged in 2/5-lb carton cases.  Reser's Fine Foods, Inc., Beaverton, OR.  UPC 071117855067 Reason for Recall: The recalled product"
    }
  ]
}

reports/hw03/METRICS.md

{
  "technique": "Semantic",
  "query": "What food recalls are related to contamination or undeclared allergens?",
  "query_vector_shape": [
    384
  ],
  "doc_vectors_shape": [
    3,
    384
  ],
  "results": [
    {
      "rank": 1,
      "store_score": 0.6292,
      "cosine_sim": 0.6817,
      "chunk_len": 165,
      "preview": "By: Trophy Nut Co. Tipp City, OH 45371 Reason for Recall: The firm stated that the product contains undeclared allergens. Classification: Class II Status: Termi"
    },
    {
      "rank": 2,
      "store_score": 0.5897,
      "cosine_sim": 0.5577,
      "chunk_len": 749,
      "preview": "Recalling Firm: Oasis Brands, Inc Product Description: Crema GuateLinda (Guatemalan Style Cream) in individually soft poly/plastic bags labeled in part: Lacteos"
    },
    {
      "rank": 3,
      "store_score": 0.5871,
      "cosine_sim": 0.6027,
      "chunk_len": 262,
      "preview": "-Reser's Gourmet Tuna Salad packaged in 2/5-lb carton cases.  Reser's Fine Foods, Inc., Beaverton, OR.  UPC 071117855067 Reason for Recall: The recalled product"
    }
  ]
}